menu_item_id,title,directions,category
7d2fc54e-c92e-47e4-830e-c434cdd70ffc,In a Hurry Chicken Curry,"Cut chicken into 1 inch cubes. Heat 2 tablespoons of oil over medium-high heat in a large skillet or wok. Add chicken and saute, stirring for about 5 minutes. Remove to side dish. Place remaining tablespoon of oil in the skillet and cook white onion, garlic and green onion until 10der. Stir in curry, ginger and cornstarch. Slowly add chicken broth; stir until smooth. Add broccoli, apple, raisins and cooked chicken. Cover and simmer for 10 minutes. Serve on a bed of rice and garnish with chopped peanuts. Makes 4 servings.",
930f2f48-b6d2-459a-8dd1-b99012b77645,Baked Zucchini with Mushrooms,"Thinly sliced mushrooms and chop onion; combine in a 10 to 12 inch frying pan with half a cup of water. Stir often on high heat until liquid evaporates and browned bits stick to pan. To deglaze pan, add 1 third cup of broth and stir browned bits free. Repeat deglazing step until onion is golden brown, 2 or 3 more times, using 1 third cup broth each time.

Beat eggs to blend; stir in zucchini crumbs, cheese, oregano, pepper, and mushroom mixture. Pour into a buttered 10 by 12 inch shallow oval casserole (or a 9 by 13 inch rectangle). Bake in a 325 degree oven until set in center when shaken, about 45 minutes top with green onions.",
9543a029-d3b9-43eb-ace3-5201abcb698f,Glazed Carrots,"Cut carrots in strips or rounds. Boil with butter, sugar and water to almost covered. Cook to fork tender. Stir in orange marmalade.",
d9962506-1685-4502-b3f1-4c885eeb5457,Fresh Apple Cake,"Mix apples and sugar well.  Add oil, nuts, and eggs.  Add vanilla and dry ingredients.  Bake at 350 degrees for 40-45 minutes.  Serve with whipped cream or top with cream cheese frosting.",Cakes
2b30451f-64f8-4954-9a08-fcc7bfc34ac0,Top Ramen Salad,"Mix Ramen seasoning packet with oil, vinegar, and sugar.  pour over mixture of salad greens, red onion, and peas.  Add crushed Ramen noodles.",Salads and Dressings
1f672f37-50d9-40ff-a063-122bdcd7da2a,Upside Down Cake,"Melt butter in oven-proof skillet.  Add brown sugar.  Arrange fruit in pan.  To make cake batter, beat eggs about 5 minutes until thick and lemon colored.  Gradually add sugar.  Then add all at once fruit juice an vanilla.  Sift together and beat in flour, baking powder, and salt.  Pour batter over fruit an bake until done, about 45 minutes at 350 degrees.",Cakes
1d4fc44e-2c73-4b04-872c-e8238e773828,Peach Almond Pie,"Sprinkle peaches with lemon and sugar.  Let stand 1 hour.  Drain to get 1 cup syrup.  Add cornstarch to syrup and blend.  Cook over low heat until thick.  Remove from heat.  Add butter, salt, and almond extract.  Cool.  Carefully stir in peaches.  Put in shell.  Chill.  Serve with whipped cream, topped with slivered almonds and marachino cherries.",Pies
8ddc6a9e-3386-4f0d-93ac-7f39a9cf86e2,Impossible Taco Pie,"Heat oven to 400 degrees. Grease pie plate, 10 x 1 1/2"".

Cook and stir beef and onion until brown; drain. Stir in seasoning mix. Spread in plate; top with chilies.

Beat milk, baking mix and eggs until smoth, 15 seconds in blender on high or 1 minute with hand beater. Pour into plate.

Bake 25 minutes. Top with tomatoes and cheese. Bake until knife inserted between center and edge comes out clean, 8 to 10 minutes. Cool 5 minutes. Top with sour cream, tomatoes, lettuce and cheese if desired. Serves 6 to 8.",
66f54ba6-779a-40ee-a9d9-0f0c63047d9c,Ginger Snap Bars,"Mix first four ingredients.  Add dry ingredients with milk.  Mix well.  Add nuts.  Pour into greased 9"" square pan.  Bake at 350 degrees for 35 to 40 minutes.  Cool in pan.  Cut into 24 bars, roll in powdered sugar.",Cookies
9493337b-8843-40fe-b97f-4cca3b687ebc,Dutch Apple Pie,"Combine apples, 1/2 cup sugar, and cinnamon.  Put into the unbaked pie shell.  Top with 1/2 cup sugar, flour, butter, and cinnamon.  Bake 45-50 minutes at 350 degrees.",Pies
dd664668-5191-419f-b289-708f27ccdf7f,Veal Parmigan,"Combine first 8 ingredients and simmer for 1 hour over medium-low heat. Dip Veal in egg and then in crumbs, mixed with half cup of parmesan. Brown lightly in hot oil. Place in single layer in large baking dish. Pour 2/3 cup of sauce over meat and bake at 350 degrees for 30 minutes. Place a slice of mozzarella on each meat slice. SPrinkle with remaining parmesan. return to oven for about 15 minutes.",
7aca4ec4-ab3a-48b8-8a97-2778e1ba51e1,Spinach Salad with Avocado,"Clean spinach.  Tear for salad.  Cut avocado in small pieces.  Sprinkle with lemon.  Slice onion as thin as possible.  Combine spinach, avocado, onion, and oranges.  Mix remaining ingredients to make dressing.  Pour dressing over salad.  Sprinkle on bacon bits.",Salads and Dressings
da9b7c12-a306-4baf-8520-c6a228816535,Pea Salad,Stir together and enjoy.,Salads and Dressings
d7dd6307-0528-43cd-9605-d8fb5ffef015,Chili Chicken,"saute onion in butter, add soups, pimento, chiles, chicken and 1/2 the cheese.

Cook noodles until tender. Drain. Stir sauce into noodles. Pour into large baking dish. Add rest of cheese or buttered crumbs.

Chill over night. Bake at 350 degrees for 1 hour.",
f7f996af-8133-408e-a871-11de833339f0,Eggplant Rollatini,"Heat broiler pan 4 inches from heat. In a small bowl, beat egg slightly with a fork; stir in ricotta, all but 1 tablespoon provolone, 2 tablespoons parsley and pepper and mix well. Set aside.

SLice eggplant into 12 lengthwise slices. Arrange in single layer on broiler pan; brush with vinaigrette. Broil 3 to 4 minutes until speckled with brown. Turn slices, brush with vinaigrette; broil 3 to 4 minutes until brown and 10der.

Adjust oven to 400 degrees. Spoon marinara over bottom of a 10 inch round shallow baking dish. Set aside.

Place broiled eggplant slices on work surface. Spread each with 2 tablespoons of the filling and sprinkle with 1/4 teaspoon of basil. Roll slices; jelly roll style. Dip each in sauce in baking dish to coat. Place seam side down. Cover in marinara. Cover with foil. Bake for 35 minutes. Sprinkle with reserved mozzarella and fresh parsley.",
1d25ed48-23bb-49eb-a779-fbac8a182700,Prune Nut Bars,"Cook Prunes - drain and chop.  Mix margarine, sugar and 1 cup of four.  Press into 9"" square pan.  Bake at 350 degrees for 25 minutes.   Sift remaining 1/3 cup flour with baking powder and salt.  Beat brown sugar into eggs, lemon and vanilla.  Add flour, mix well.  Add prunes, nuts, and coconut.  Spread over baked bars.  Bake at 350 degrees for 30-35 minutes.  Cool.  Cut into 24 bars.  Roll in confectioner's sugar.  ",Cookies
f64e218b-4481-4898-b95f-e4a695989c24,Green Beans Salerno,"Combine salad oil, vinegar and spaghetti sauce mix. Pour over drained beans. Chill.

Before serving, toss beans with shredded lettuce and crumbled bacon.",
75929f5e-f3fb-42b1-9e71-0aed7f8e5066,Pasta Primavera,"For pesto, in a blender container or food processor bowl. Place fresh basil or parsley, red or green pepper, mayonnaise, parmesan cheese, lemon juice, salt, red pepper and black pepper. Cover; blend or process till pureed. Set aside.

In a large amount of boiling salted water cook pasta for 6 minutes. Add carrots and onion. Return to boiling; cook for 2 minutes. Add zucchini or yellow squash. return to boiling; cook for 2 minutes more.

Drain pasta and vegetables; return to saucepan. Stir in pesto; add chicken to turkey. Toss well to combine. Cook over very low heat for 2 minutes or until heated through, tossing occasionally. Serve immediately. Makes 4 servings.",
d9e687a3-8b34-47de-8d2d-4c55cd32c70e,Savory Chicken Casserole,"Brown chicken in shortening.

In skillet blend: cream of chicken soup, milk, poultry seasoning, salt and pepper. Add carrots, onions, and lima beans.

Cover, cook 20 minutes. Pour over chicken. Bake covered at 375 degrees for 1 hour. Uncover and cook 15 minutes.",
